updated	title	description	tags	除外	link	image
2020-09-10T07:00:00.000000000Z	ビリー・アイリッシュ、ギターメーカーのフェンダーとのコラボ・ウクレレが発売！ ビリーがウクレレの魅力を語る[写真・動画あり] - TVグルーヴ・ドット・コム	人気歌手のビリー・アイリッシュと、世界的ギターメーカーのフェンダーがコラボし、特別仕様のウクレレ「ビリー・アイリッシュ・シグネチャー・ウクレレ」が発売開始となった（日本では9月12日から販売開始）。 フェンダー社は9月8...			https://www.tvgroove.com/?p=49198	https://www.tvgroove.com/wp-content/uploads/2020/09/billieeilish.jpg
2020-09-09T07:00:00.000000000Z	グラミー賞5部門受賞アーティスト、ビリー・アイリッシュのシグネイチャーウクレレを発売開始！ - PR TIMES	フェンダーミュージックのプレスリリース（2020年9月9日 09時00分）グラミー賞5部門受賞アーティスト、ビリー・アイリッシュのシグネイチャーウクレレを発売開始！			https://prtimes.jp/main/html/rd/p/000000180.000021878.html	https://prtimes.jp/i/21878/180/ogp/d21878-180-177972-0.jpg
2020-09-09T07:00:00.000000000Z	Billie Eilish×Fenderのシグネイチャーウクレレ発表 ウクレレを弾く動画も - DIGLE MAGAZINE	フェンダーから、Billie Eilish（ビリー・アイリッシュ）がデザインしたシグネイチャーウクレレ『BILLIE EILISH SIGNATURE UKULELE』が9月12日（土）より発売。楽器全体に彼女のトレードマークである『BLOHSH™』シンボルを配し、彼女の好みのスペックと美学を完全に具現化。			https://mag.digle.tokyo/news/92483	https://i0.wp.com/mag.digle.tokyo/wp-content/uploads/2020/09/billie-news-mv.jpg?fit=650%2C414&#038;ssl=1
2020-09-09T07:00:00.000000000Z	フェンダー、ビリー・アイリッシュのシグネイチャーウクレレ「Billie Eilish Signature Ukulele」を発売 - BARKS	FENDER MUSICAL INSTRUMENTS CORPORATION（以下、フェンダー）が、ビリー・アイリッシュのシグネイチャーウクレレを発表。「Billie Eilish Signature Ukulel...			https://www.barks.jp/news/?id=1000188681	https://img.barks.jp/img/article/1000188681/H/1200.jpg
2020-09-04T07:00:00.000000000Z	多才なメドベージェワ、意外な“楽器挑戦ショット”に海外反響「何が弾けるの？」 - THE ANSWER	フィギュアスケートのエフゲニア・メドベージェワ（ロシア）がインスタグラムを更新。ウクレレに挑戦する様子を画像付きで公開し、「良い写真」「何が弾けるの？」「ウクレレソングのアルバムはいつ？」と海外ファンの視線を集めている。			https://the-ans.jp/news/125768/	https://the-ans.info/wp-content/uploads/2019/03/20190326_medvedeva_ap.jpg
2020-08-26T07:00:00.000000000Z	【音楽でハワイ】色んなテクニックを使った曲をウクレレで弾いてみよう！｜allhawaii - allhawaii	第2回目のウクレレレッスンはいかがでしたか？本日のウクレレレッスンでは色んなテクニックを使った曲にチャレンジしてみませんか？本日の課題曲はTheLionSleepsTonighitです！スクラッチ、ノ…			https://www.allhawaii.jp/article/4427/	https://d2znjoo7p8l5rk.cloudfront.net/column_cover/user/79/article/4427/20082607235760991.png
2020-08-23T07:00:00.000000000Z	13歳の天才ウクレレ少年が弾く「Bad Guy」カバーが超絶技巧！ウクレレのイメージが変わるよ/ 8月23日は #ウクレレの日 - youpouch.com	ウクレレの曲というと、のんびりとしたハワイアンミュージックを思い浮かべる人も多いかもしれません。 しかし今回ご紹介する動画は、そんなイメージを覆すような激しく …			https://youpouch.com/2020/08/23/708157/	https://youpouch.com/wp-content/uploads/sites/4/2020/08/fen.jpg?w=580&amp;h=305&amp;crop=1
2020-08-23T07:00:00.000000000Z	ハワイ激動の歴史から産まれたヒーリングサウンド。8月23日は「ウクレレの日」(tenki.jpサプリ 2020年08月23日) - 日本気象協会 tenki.jp - tenki.jp	ウクレレ（UKULELE）は、スティール・ギターとともにハワイアン・ミュージックの中心となる優れた楽器です。1879年の8月23日、ハワイに到着した、ヨーロッパ西端のマデイラ島からの移民船に、マデイラの民族楽器マシェーテ、またはブラギーニャを携えた青年がいました。青年はハワイに到着すると楽器を奏で、歌を歌いました。のちに、その楽器をもとにした「UKULELE（ウクレレ）」と呼ばれる楽器が誕生し、それを記念して8月23日は「ウクレレの日」と制定されました。			https://tenki.jp/suppl/kous4/2020/08/23/29952.html	https://storage.tenki.jp/storage/static-images/suppl/article/image/2/29/299/29952/1/large.jpg
2020-08-19T07:00:00.000000000Z	セラピー性の高い楽器ウクレレ、孤独が癒えウキウキできる（NEWS ポストセブン） - Yahoo!ニュース	初めてでもすぐ弾けて、何といっても明るく軽やかな音色が魅力のウクレレ。現在87才の高木ブーさんもウクレレ奏者として知られ、高齢者の習い事としても人気だが、オンライン教室で初挑戦する人も増えていると			https://news.yahoo.co.jp/articles/d93f9e63eefbe3764d0d2e0b04ab1cedab37846e	https://amd.c.yimg.jp/amd/20200819-00000005-pseven-000-3-view.jpg
2020-08-18T07:00:00.000000000Z	MBS「ちちんぷいぷい」に枚方出身ウクレレ少年 近藤利樹がでるみたい。8月19日放送。Billboard Live最年少出演なども - 枚方つーしん	MBS「ちちんぷいぷい」に枚方出身のウクレレ少年 近藤利樹さんが出演するようです。近藤利樹｜SonyMusic公式サイトメディア情報近藤さんといえば、「嵐にしやがれ」をはじめ数々のテレビ出演や、史上最年少で「FUJI ROCK FESTIVAL’19」に出演したりワンマンライブを開催する			http://www.hira2.jp/topic/kondotoshiki-20200818.html	https://livedoor.blogimg.jp/hiratsu/imgs/f/9/f91736f3.jpg
2020-08-18T07:00:00.000000000Z	高木ブーは代表的奏者 僕からウクレレ取ったら何も残らぬ（NEWS ポストセブン） - Yahoo!ニュース	高齢の初心者でも気軽に楽しめるウクレレが密かなブーム。4本の弦をつま弾くだけで、温かなハーモニーがコロナで凹んだ心を元気にしてくれる。日本を代表するウクレレ奏者としても知られる高木ブーさん（87才			https://news.yahoo.co.jp/articles/1f4252ce1303b526bf81049f2502a1bf4d68b408	https://amd.c.yimg.jp/amd/20200818-00000010-pseven-000-2-view.jpg
2020-08-17T07:00:00.000000000Z	【音楽でハワイ】オンラインで聴くウクレレ・ピアノ演奏｜allhawaii - allhawaii	ハワイでは、日本と違って自然な形で、ミュージックが耳に入ってきますよね？ホテルのロビー、ラウンジ、バー、レストラン、ショッピングモールと、聴ける場所が沢山あります。ハワイ旅行をしなくても、そんな演奏が…			https://www.allhawaii.jp/article/4401/	https://d2znjoo7p8l5rk.cloudfront.net/column_cover/user/79/article/4401/20081516012457913.png
2020-08-14T07:00:00.000000000Z	１３歳ウクレレ奏者・近藤利樹が８・２３にビルボード生配信ライブに出演 昨夏フジロックに続く「史上最年少」更新…新境地見せる｜ニフティニュース - ニフティニュース	“ナニワの光速ウクレレ・プレイヤー”の異名を誇る現役中学生・近藤利樹（１３）が、８月２３日の午後４時から、ビルボードライブ史上最年少で生配信ライブを行うことになった。７歳からウクレレを始め、…	ウクレレ奏者,近藤利樹		https://news.nifty.com/article/entame/showbizd/12265-759930/	https://news.nifty.com/cms_image/news/entame/12265-759930/thumb-12265-759930-entame.jpg
2020-08-14T07:00:00.000000000Z	１３歳ウクレレ奏者・近藤利樹が８・２３にビルボード生配信ライブに出演 昨夏フジロックに続く「史上最年少」更新…新境地見せる - スポーツ報知	“ナニワの光速ウクレレ・プレイヤー”の異名を誇る現役中学生・近藤利樹（１３）が、８月２３日の午後４時から、ビルボードライブ史上最年少で生配信ライブを行うことになった。７歳からウクレレを始め、大人顔負			https://hochi.news/articles/20200814-OHT1T50057.html	https://hochi.news/images/2020/08/14/20200814-OHT1I50076-L.jpg
2020-08-13T07:00:00.000000000Z	持ち前の「ガラガラ」武器に 密なし 宇都宮動物園プール 16日、ウクレレライブも｜地域の話題,県内主要｜下野新聞「SOON」ニュース｜新型肺炎-COVID19-｜下野新聞 SOON(スーン) - 下野新聞	【宇都宮】利用者が少ないことから「日本一すいているかもしれない」を売りにしている宇都宮動物園（上金井町）のプール。例年、１日の平均利用者数は10人足らずで、特に今年は新型コロナウイルス対策の３密回避が指摘されているだけに、持ち前の「ガラガラ」が武器になっている。16日には、プールサイドでウクレレライブも行われる。 プールは同園入り口付近にあり、１周約３００メートルのドーナツ型プールや幼児向けの水浴びスペース、高さ約８メートルの滑り台を備える。 今年は７月18日にオープン。			https://www.shimotsuke.co.jp/articles/-/346595	https://www.shimotsuke.co.jp/mwimgs/6/6/600wm/img_669342bc600e8017feed0ecc8222ba0d3520314.jpg
2020-08-08T07:00:00.000000000Z	海の声をウクレレで弾き語りcoverしました : みーちゃん(yuma) 公式ブログ - lineblog.me	夏をお届け😁			https://lineblog.me/michan39/archives/13261186.html	https://i.ytimg.com/vi/htT91nQpY0U/maxresdefault.jpg
2020-08-08T07:00:00.000000000Z	【音楽でハワイ】はじめてのウクレレレッスンを受講してみよう｜allhawaii - allhawaii	ハワイの思い出にウクレレをおみやげに購入された方、ウクレレをいつか弾けるようになりたいとウクレレが押し入れやクローゼットで眠っているという方、チャンスです。これからウクレレをはじめようという、ウクレレ…			https://www.allhawaii.jp/article/4378/	https://d2znjoo7p8l5rk.cloudfront.net/column_cover/user/79/article/4378/20080801402398906.png
2020-08-04T07:00:00.000000000Z	千葉翔也のバッチリしようや Reading.47 ウクレレ | JOURNAL 連載 - KIKI by VOICE Newtype	いよいよ夏本番ということで、お部屋で南国気分を味わえる王道アイテム「ウクレレ」に挑戦！ 初めて触れるとは思えない上達ぶりで、童謡やヒットソングを奏でるうちに……なんと、連載テーマソングまでできちゃった…			https://kiki-voice.jp/journal/1040	https://kiki-voice.jp/data/1040/20200803_150936_381341.jpg
2020-08-04T07:00:00.000000000Z	フェンダー、ストラトやジャズマスターのシェイプを採用したウクレレ「Fullerton Ukulele」シリーズ販売開始（BARKS） - Yahoo!ニュース	カリフォルニア州アナハイムで開催されたWinter NAMM 2020で発表され注目を集めたフェンダーの新しいウクレレの国内販売がいよいよスタート。フェンダーのアイコニックなエレクトリックギターのシ			https://news.yahoo.co.jp/articles/afa7b8e399b9c4557bec6ff62f9d1f439aaf7d9a	https://amd.c.yimg.jp/amd/20200804-00186771-bark-000-1-view.jpg
2020-07-30T07:00:00.000000000Z	【音楽でハワイ】ジョディ・カミサトさんからウクレレの基礎を学ぼう！｜allhawaii - allhawaii	Aloha!ハワイアンミュージックの象徴的な楽器として世界で認知されている、ウクレレ。そのウクレレの基礎をハワイ州観光局が行っているプロモーション、おうちでハワイの【音楽でハワイ】にて、ハワイで活躍す…			https://www.allhawaii.jp/article/4361/	https://d2znjoo7p8l5rk.cloudfront.net/column_cover/user/79/article/4361/20073013501074703.png
2020-07-30T07:00:00.000000000Z	この夏に始めよう！極めよう！今年はウクレレが当たる！「ウクレレ・フェア2020」が今年も開催【応募締切2020年9月30日】 - PR TIMES	株式会社インプレスホールディングスのプレスリリース（2020年7月30日 13時30分）この夏に始めよう！極めよう！今年はウクレレが当たる！[ウクレレ・フェア2020]が今年も開催 応募締切2020年9月30日			https://prtimes.jp/main/html/rd/p/000003376.000005875.html	https://prtimes.jp/i/5875/3376/ogp/d5875-3376-625217-0.jpg
2020-07-26T07:00:00.000000000Z	ウクレレ弾いてリラックス 稲美の障害者支援施設 - 神戸新聞	障害者を対象にした就労継続支援Ｂ型事業所「カヤック」（兵庫県稲美町中村）の利用者が、ウクレレを演奏するリラクセーションに取り組んでいる。新型コロナウイルスの感			https://www.kobe-np.co.jp/news/touban/202007/0013543708.shtml	https://www.kobe-np.co.jp/news/touban/202007/img/b_13543709.jpg
2020-07-21T07:00:00.000000000Z	現役中学生ウクレレプレイヤー近藤利樹、Billboard Live（生配信ライブ）最年少出演決定！ - ジェイタメ	-			https://jtame.jp/entertainment-2/30139/	https://jtame.jp/data/wp-content/uploads/2020/07/a2fe5bb85274c82c50fbd2bb404a618f.jpg
2020-07-18T07:00:00.000000000Z	【家族でハワイ】ウクレレ・フェスティバル・ハワイにオンラインで参加しよう｜allhawaii - allhawaii	毎年7月、オアフ島カピオラニ公園でウクレレフェスティバルが開催されます。世界中からウクレレアーティスト、ウクレレファンが集結するイベントです。今年は、1971年から開催したウクレレ・ハワイ・フェスティ…			https://www.allhawaii.jp/article/4342/	https://d2znjoo7p8l5rk.cloudfront.net/column_cover/user/79/article/4342/20071900055976380.png
2020-07-16T07:00:00.000000000Z	【満席のため受付終了】【音楽でハワイ】ライブウクレレレッスン開催！楽しくハワイを体験しよう！｜allhawaii - allhawaii	満席に伴いライブウクレレレッスンの受付は終了いたしました。先着でご参加いただける参加者の皆さまには、今週中にメールにてレッスンの参加URLをご案内させていただきます。残念ながら、ご参加いただけない皆さ…			https://www.allhawaii.jp/article/4329/	https://d2znjoo7p8l5rk.cloudfront.net/column_cover/user/79/article/4329/20071419035356753.png
2020-07-04T07:00:00.000000000Z	氷見にウクレレ工房 富山市出身の平川さん - 47NEWS	■澄んだ弦の響き追求 イタリアでバイオリン製作の修業をした富山市出身のウクレレ製作者、平川大（ひろし）さん（４０）が氷見市島尾に工房を開いた。「きれいな仕上がりと澄んだ響きを追求したい」と話す。 ...			https://www.47news.jp/4980867.html	https://img.cf.47news.jp/public/photo/c73ff5ec4f499786af3fd55480b12762/photo.jpg
2020-06-15T07:00:00.000000000Z	“ウクレレの神様”オータサン、85歳でニューAL『アメイジング・ウクレレ』発売 - BARKS	世界的ウクレレ・プレイヤーであり、“ウクレレの神様”とも称されるオータサン（ハーブ・オオタ）のニューアルバム『アメイジング・ウクレレ』が、7月22日（水）にリリースされる。現在85歳のオータサンの新作が日本で発売さ...			https://www.barks.jp/news/?id=1000184156	https://img.barks.jp/img/article/1000184156/H/1200.jpg
2020-06-11T07:00:00.000000000Z	中学生ウクレレプレイヤー近藤利樹 『めざましテレビ』“キラビト”レジェンド編に出演決定 - http://spice.eplus.jp/	中学生ウクレレプレイヤー近藤利樹 『めざましテレビ』“キラビト”レジェンド編に出演決定			https://spice.eplus.jp/articles/270756	https://spice.eplus.jp/images/d2xEuINnD08ddk0DSiC13XTSM1t2e91WsSoxc3Y3QcjIYvod2zwZuiBN8tECua4H
2020-06-04T07:00:00.000000000Z	「あさイチ」近江アナ、朝ドラ「半分、青い。」主題歌をウクレレで熱唱に「癒されました」 - ENCOUNT	NHKの情報番組「あさイチ」の公式インスタグラムが4日、更新され、近江友里恵アナウンサーがウクレレを弾きながら美声を披露した。			https://encount.press/archives/53748/	https://encount.press/wp-content/uploads/2020/05/01379c40b264f666a072441571f8aee0-1.jpg
2020-06-04T07:00:00.000000000Z	ウクレレのある日常（！） - SPUR.JP	在宅期間に買ったもの。やはり家で過ごす時間を快適にしたいという気持ちが盛り上がり、スマートスピーカー（これについては本当に買ってよかったのでまた書きたいです）、ベランダで育てるための野菜の苗（トマト、育ってます！）、美味しいお取り寄せ食材、...			https://spur.hpplus.jp/fashion/smallgoodthings/202006/04/GJh1MpU/	http://static-spur.hpplus.jp/upload/image/manager/64/JnkScwA-1200x630.jpg
2020-06-04T07:00:00.000000000Z	ウクレレ界の雷様・高木ブーが同世代の「神様」出演番組にエール、自身は毎週ユーチューブ撮影｜まいどなニュース - 神戸新聞社	世界的なウクレレ奏者ハーブ・オオタ(左)とのツーショットを披露した高木ブー(インスタグラムより＠bootakagi85) 「ウクレレの雷様」が「ウクレレの神様」にエールを送った。ザ・ドリフターズの高木ブーが４日、自身のインスタグラム...			https://maidonanews.jp/article/13430475	https://public.potaufeu.asahi.com/8ba0-p/picture/21603512/1908912311b284541d627ec878cfd6ed.jpg
2020-06-03T07:00:00.000000000Z	中学生ウクレレプレイヤー近藤利樹、「news every.」お天気コーナーテーマ曲に起用 - BARKS	現役中学生ウクレレプレイヤー、近藤利樹のオリジナル曲「BEAUTIFUL GIRL」が、日本テレビ系「news every.」お天気コーナーテーマソング（6月～8月）に決定した。◆1stフルアルバム『WITH			https://www.barks.jp/news/?id=1000183583	https://img.barks.jp/img/article/1000183583/H/1200.jpg
2020-05-26T07:00:00.000000000Z	ステイホームでウクレレに挑戦してみよう♪初心者におすすめのハワイアンウクレレ曲をご紹介 - ニコニコニュース	家で過ごす時間が多いなか、今より楽しく充実したお家時間にするために、ウクレレにチャレンジしてみるのはいかがですか? ポロンポロンとしたウクレレの音は、夏は涼しく爽やかに、冬は暖かく穏やかな気持ちにさせてくれます。 今回は、誰でも簡単にウ…			https://news.nicovideo.jp/watch/nw7329770	https://news.cdn.nimg.jp/articles/images/7329770/3d09cd3b4b0e3b75f01b95b7715951aeecf573dc576a31981e04817fa482fded2a7cc94ab2276f6716bfd5eeb9bf90dab7800bd7209c03a60303688e36eac5c9
2020-05-26T07:00:00.000000000Z	ヤンゴンでオンラインアートスクール Kポップダンスやウクレレも - 足利経済新聞	シンガポールを拠点とするアートスクール「Art Village」が、オンラインのミャンマー校「Art Village Myanmar」を始めて2カ月がたった。			https://yangon.keizai.biz/headline/60/	https://images.keizai.biz/yangon_keizai/headline/1590471888_photo.jpg
2020-05-22T07:00:00.000000000Z	近江アナがウクレレ披露／21日芸能社会ニュース - 芸能 - ニッカンスポーツ	5月21日の芸能・社会ニュースをまとめて振り返ります。NHK近江友里恵アナウンサー（31）の結婚報道を受け、朝の情報番組「あさイチ」の公式インスタグラムにファ… - 日刊スポーツ新聞社のニュースサイト、ニッカンスポーツ・コム（nikkansports.com）。			https://www.nikkansports.com/entertainment/news/202005210000024.html	https://www.nikkansports.com/entertainment/news/img/202005210000024-w500_0.jpg
2020-05-22T07:00:00.000000000Z	動画で楽しく学ぼう！超初心者向け人気ウクレレ入門書がリニューアル - ストレートプレス	ステイホームの今、ウクレレを始めたいと思っている人にぴったりの教則本！ 『DVDで今日から弾ける！かんたんウクレレ New Edition』1380円(税別)が、リットーミュージックから5月23日(土)に新発売される。 ...			https://straightpress.jp/20200522/370613	https://straightpress.jp/wp-content/uploads/2020/05/yama05181515-300x225.jpg
2020-05-21T07:00:00.000000000Z	近江アナがウクレレ披露、結婚報道には祝福の声続々 - ニッカンスポーツ	NHK近江友里恵アナウンサー（31）の結婚報道を受け、朝の情報番組「あさイチ」の公式インスタグラムにファンから祝福の声が多数寄せられた。近江アナは21日、自身… - 日刊スポーツ新聞社のニュースサイト、ニッカンスポーツ・コム（nikkansports.com）。			https://www.nikkansports.com/entertainment/news/202005210000147.html	https://www.nikkansports.com/entertainment/news/img/202005210000147-w500_0.jpg
2020-05-21T07:00:00.000000000Z	楽器未経験の僕がウクレレに挑戦！ 半日練習したら1曲弾けるようになりました - roomie	みなさんは「おうち時間」をどんな風に過ごしていますか？ 自分の時間を持てる今だからこそ、普段できないことややってみたかったことにチャレンジしてみるのもいいかもしれませんね。 ということで、僕は前から弾いてみたかったウクレレにチャレンジ中です！			https://www.roomie.jp/2020/05/620366/	https://assets.media-platform.com/roomie/dist/images/2020/05/F7C84583-6C8F-474D-BA90-8A71490FBC0C.jpg
2020-05-18T07:00:00.000000000Z	フルカラーの紙面と動画で楽器の基礎の基礎から学べるウクレレ入門書の決定版がリニューアル！ - PR TIMES	株式会社インプレスホールディングスのプレスリリース（2020年5月18日 11時00分）フルカラーの紙面と動画で楽器の基礎の基礎から学べるウクレレ入門書の決定版がリニューアル！			https://prtimes.jp/main/html/rd/p/000003265.000005875.html	https://prtimes.jp/i/5875/3265/ogp/d5875-3265-973260-6.jpg
2020-05-08T07:00:00.000000000Z	ジャッキーちゃん、おすすめ“おうちエンタメ”は「ウクレレ」「ざこば・鶴瓶らくごのご」「よつばと！」【#StayHome連載】（ザテレビジョン） - Yahoo!ニュース	新型コロナウイルスによる外出自粛が続き、自宅で過ごす時間が長くなる中、著名人におすすめの「おうちエンタメ」をアンケートで聞く「#StayHome連載」。普段演者としてパフォーマンスする側の人々は自宅			https://news.yahoo.co.jp/articles/0bea1321b81eb2edcc1e79b4ba54f8bbcbf4a804	https://amd.c.yimg.jp/amd/20200423-00231172-the_tv-000-3-view.jpg
2020-05-02T07:00:00.000000000Z	【音楽でハワイ】スラックキー・ギターやウクレレのインストゥルメンタルミュージックでハワイを感じよう！｜allhawaii - allhawaii	【音楽でハワイ】シリーズ第4弾は、インストゥルメンタルのハワイアンミュージックコンサートをお届けします！インストゥルメンタルミュージックで使用されるスラックキー・ギターやウクレレは、1778年以降に西…			https://www.allhawaii.jp/article/4229/	https://d2znjoo7p8l5rk.cloudfront.net/column_cover/user/79/article/4229/20050204595790579.jpg
2020-05-02T07:00:00.000000000Z	社告：毎日文化センター 名駅 ウクレレとハワイアンソング ／愛知 - 毎日新聞	あなたも３日でミュージシャン。「ウクレレとハワイアンソング」講座は、小学生から中高年まで幅広い層に人気です。 ウクレレは弦楽器の中でも小さくて軽い楽器です。弦はギターより少ない４本で、手が小さい人や力が弱い人も扱えます。			https://mainichi.jp/articles/20200502/ddl/k23/040/182000c	https://cdn.mainichi.jp/vol1/2020/05/02/20200502ddlk23040226000p/0c8.jpg?1
2020-04-28T07:00:00.000000000Z	続く外出自粛、ストレス癒やすのは「ウクレレ」？老舗ギターメーカーが提案 - BLOGOS	新型コロナウイルス感染症にともなう緊急事態宣言が発出され、思うように出かけられない毎日が続いている。慣れない状況に、ストレスを感じている人も多いのではないだろうか。そんな「巣ごもり」生活中に少しでもリラックスしてもらおうと、「K.Yairi（K.ヤイリ）」ブラ			https://blogos.com/article/453865/	https://static.blogos.com/media/img/334816/ref_xl.png
