updated	title	description	tags	除外	link	image
2020-10-10T22:30:00.000000000Z	元トップ営業マン、キャリア捨て設立した「大地の学校」 - 朝日新聞デジタル	学校生活になじめない子どもや、自ら学ぶ内容を選びたい子どもの居場所が、愛知県岡崎市にできた。開設した男性は、かつてアメリカンフットボール選手として全国を舞台に活躍し、大手製薬会社の営業マンとしてトッ…			https://www.asahi.com/articles/ASN9X3HYLN9HOBJB00C.html	https://www.asahicom.jp/articles/images/c_AS20201007001062_comm.jpg
2020-10-10T03:30:00.000000000Z	斉藤由貴、歌手デビュー35周年記念プログラムでデビュー当時の思いを明かす - ザテレビジョン	【ザテレビジョン芸能ニュース！】斉藤由貴の歌手デビュー35周年記念プログラム「斉藤由貴 the live 2020～35th anniversary～」が10月17日(土)、CSテレ朝チャンネル1で放送される。ポニーテールにセーラー...			https://thetv.jp/news/detail/245748/	https://thetv.jp/i/nw/245748/1552370.jpg?w=615
2020-10-09T22:02:22.000000000Z	箸が持てない…難病ALSの人気声優が足の次に感じた「手の異変」（現代ビジネス） - Yahoo!ニュース	ALS(筋萎縮性側索硬化症)を検索すると「感覚があるままに体が動かなくなる病気」という説明が多くあります。もう少し詳しい記事を探すと「筋肉が動かなくなってしまう」という説明がなされています。ではこ			https://news.yahoo.co.jp/articles/78cf2466b70cbbc12db73a030184e3e6d46fc24d	https://amd.c.yimg.jp/amd/20201010-00076280-gendaibiz-000-3-view.jpg
2020-10-09T08:00:00.000000000Z	Piascore楽譜ストア 10月9日、 人気の新譜を追加！『テルーの唄』、『人生のメリーゴーランド』、『いつも何度でも』ほか - valuepress	Piascore 株式会社のプレスリリース（2020年10月9日 17時）。Piascore楽譜ストア 10月9日〜 人気のスタジオジブリ作品の新譜を追加！ 『テルーの唄』、『人生のメリーゴーランド』、『いつも何度でも』ほかを販売いたしました。			https://www.value-press.com/pressrelease/255343	https://files.value-press.com/czMjZXllY2F0Y2gjMjQzMTUjMjQzMTVfb2FyZXhRTVZZYi5wbmc.png
2020-10-09T06:02:40.000000000Z	高校生が選んだリラックスできる曲14選 学校生活や勉強で疲れたあなたへ｜高校生新聞オンライン｜高校生活と進路選択を応援するお役立ちメディア - 高校生新聞	リラックスしたいときに聴きたくなる曲を高校生記者に紹介してもらいました。優しいメロディー、深い歌詞UVERworld「一滴の影響」私のリラックスしたいときに聴く曲は、UVERworldの一滴の影響です			https://www.koukouseishinbun.jp/articles/-/6854	https://koo.ismcdn.jp/mwimgs/5/c/-/img_5c366910c12a235542061f421543bcc1586008.jpg?rd=201710041230
2020-10-09T04:00:00.000000000Z	『2020丹波の森フェスティバル』丹波市 - KissPRESS	丹波の森公苑（丹波市）で10月25日、『丹波の森フェスティバル～森とふれあおう！まるごと満喫☆丹波の森公苑～』が開催されます。今年は新型コロナウイルス感染症拡大防止のため、中庭芝生広場を中心に規模を縮小して実施されますが、自然と触れ合えるイベントとあって期待度大！参加無料の里山ハイキングやツリーイング体験など自然と触れ合うイベントが用意されているほか、室内外のワークショップ、展示ギャラリーなどが充実しています。また、会場内のステージではウクレレやオカリナの演奏や紙芝居といった催しが実施予定です。自然を感じながらゆったりとした一日を過ごせそうですね。			https://kisspress.jp/articles/30043/	https://kisspress.jp/shared/img/articles/basic/30000-30099/30043/img5f7beca9bbc96_tw.jpg
2020-10-08T15:05:10.000000000Z	川崎・河原町団地近くの「カフェデニム」が18周年 ロックヒルズガーデンで記念イベント - 川崎経済新聞	川崎の河原町団地近くにある「カフェデニム」（川崎市幸区遠藤町）が18周年を迎えた。			https://kawasaki.keizai.biz/headline/989/	https://images.keizai.biz/kawasaki_keizai/headline/1602167623_photo.jpg
2020-10-08T03:03:18.000000000Z	シンガー・ソングライター 山木康世さん 父の思い出は土のにおい 生き方を相談したくなる - 東京すくすく	祖父が山形から北海道へ入植父はジャガイモの研究員生まれは札幌です。父方の祖父が山形から入植し、リンゴ園を開きました。リンゴ栽培は伯父が継ぎましたが、敷地内で父と母、姉2人、兄1人の6人で暮らしました。1913（大正2）年生ま...			https://sukusuku.tokyo-np.co.jp/kazokunokoto/36699/	https://sukusuku.tokyo-np.co.jp/wp-content/uploads/2020/10/T200917G00039201-e1602123514823-300x300.jpg
2020-10-08T07:00:00.000000000Z	ウクレレ歌手八桁さん ｢華々しくデビューしたい｣ ライブのためＣＦ（クラウドファンディング）に挑戦 | 都筑区 | タウンニュース - タウンニュース	ウクレレ歌手の八桁（はけた）圭佑さん＝青葉台在住＝が所属する４人組アイドルバンド「Ｔｈｅ Ｂｕｂｂｌｅｓ（バブルス）」はプレデビューライブ開催のため、クラウドファンディングに挑戦している。 ＳＤＧｓを世の中に広めることを目的に、今年１月に結成。３月の男女混合バレーボールワールドカップの会場でデビューライブを行う予定だった...			https://www.townnews.co.jp/0104/2020/10/08/545514.html	https://www.townnews.co.jp/0104/images/a000997548_02.jpg
2020-10-05T07:00:00.000000000Z	世界に通じるモデル15歳ウクレレ奏者Ｕｋｕｒｅｎａ - ニッカンスポーツ	ウクレレ奏者のUkurena（ウクレナ＝15）がYouTubeチャンネル「rena_ukurena」を開設した。陽気なだけでなく、甘く切ないメロディーを奏でて… - 日刊スポーツ新聞社のニュースサイト、ニッカンスポーツ・コム（nikkansports.com）。			https://www.nikkansports.com/entertainment/news/202010040000555.html	https://www.nikkansports.com/entertainment/news/img/202010040000555-w500_0.jpg
2020-10-04T07:00:00.000000000Z	【活躍する女性】新しい「自分」をプロデュース 子供との日常が生んだ「虫のつぶやき」 荻野目洋子が語る仕事と家庭・子育て (2020年10月4日) - エキサイトニュース	荻野目洋子さんといえば、「ダンシング・ヒーロー（EatYouUp）」。歌って踊る、キラキラしたアイドルとして多くのファンを沸かせた。2017年、そんな大ヒット曲がリバイバルヒット。その3年後の夏。ウク...			https://www.excite.co.jp/news/article/Jcast_kaisha_395679/	https://s.eximg.jp/exnews/feed/Jcast/Jcast_kaisha_395679_1.jpg
2020-10-02T21:00:00.000000000Z	涙が止まらない、物を壊す…被災児童のSOS 熊本で寄り添う認定NPO - 西日本新聞	熊本県南部を襲った豪雨は多くの家屋に被害を与え、子どもたちにも過大なストレスをもたらした。涙が止まらない、食事の量...｜西日本新聞は、九州のニュースを中心に最新情報を伝えるニュースサイトです。九州・福岡の社会、政治、経済などのニュースを提供します。			https://www.nishinippon.co.jp/item/n/650721/	https://www.nishinippon.co.jp/uploads/image/686452/sns_IP201002JAA000478000.jpg
2020-10-02T06:00:59.000000000Z	カラニ・ペア他、ハワイを代表するアーティストがJ-popをハワイアンにリメイクしたコンピレーション・アルバム第2弾を発売決定（E-TALENTBANK） - Yahoo!ニュース	日本の名曲をハワイ語＆英語に訳し、グラミー受賞の実力派から、大注目のニューフェイスまでハワイの有名ミュージシャン達を中心にしたコンピレーション・アルバム「ALOHA &amp; MAHALOⅡ ～J-son			https://news.yahoo.co.jp/articles/b5fac0645ada6b34875246bf883d2ff412ec5ae6	https://amd.c.yimg.jp/amd/20201002-00168273-etalent-000-1-view.jpg
2020-10-01T07:00:00.000000000Z	Journey Guitars オンラインストアで Strings 4 U 無料体験レッスンの提供を開始 - PR TIMES	株式会社アンコールMSのプレスリリース（2020年10月1日 07時48分）Journey Guitars オンラインストアで Strings 4 U 無料体験レッスンの提供を開始			https://prtimes.jp/main/html/rd/p/000000012.000051720.html	https://prtimes.jp/i/51720/12/ogp/d51720-12-772747-0.jpg
2020-10-01T07:00:00.000000000Z	親子2人でハマり中 : 美奈子 公式ブログ - lineblog.me	親子で急にどハマりしてるウクレレ。 独学で 2人で頑張って練習中( *´艸`) 同じ趣味とかあると 会話が増えるな‪⸜(*ˊᵕˋ*)⸝‬ #親子2人でハマり中 #ウクレレ #癒される			https://lineblog.me/minako/archives/13265134.html	https://obs.line-scdn.net/0ht288uqbzKx0FQQIOvmlUSkkcLXJ8IjEVbzk8J3AXITNwLTwdbTs4I38RL3M0KihKO0IsLF8lIUZ2MR9La3gWGV8mJnpAGGQJY1AnGnRddSopcWlCPCJkfiBJJ38gdm9IfCY2KCEUICp_
2020-09-29T07:00:00.000000000Z	つじあやの、配信オーディオライブより「風になる」スタジオバージョンを公開（BARKS） - Yahoo!ニュース	つじあやのが、9月21日に初の配信ライブを敢行。披露された『風になる』のスタジオライブの模様が、つじあやのオフィシャルYouTubeチャンネルで公開された（https://youtu.be/Glw7			https://news.yahoo.co.jp/articles/3e5513bb39524284a42404a86d87bd8ef138ce6b	https://amd.c.yimg.jp/amd/20200929-00189810-bark-000-1-view.jpg
2020-09-28T07:00:00.000000000Z	「ウィズコロナの新しい園ルール」を子どもたちに伝えるお助けアイデア大特集『PriPri 11月号』：時事ドットコム - 時事通信	［株式会社世界文化ホールディングス］2020年9月28日（月）保育が広がるアイデアマガジン『PriPri（プリプリ）11月号』9月28日（月）発売の『PriPri 11月号』では、新しい生活様式を子どもたちに分かりやすく伝えるアイデアを特集。また、絵本専門士や著名人がおすすめする絵本を紹介します。■あたらしい「ルール」や「あそび」を知ろう！Withコロナの園生活5月に「新しい生活様式」が呼びかけられて以降、マスクの着用や衝立など、ソーシャルディスタンスを保つ工夫があらゆる場所で見られるようになり…			https://www.jiji.com/jc/article?k=000000924.000009728&g=prt	https://prtimes.jp/i/9728/924/resize/d9728-924-655899-1.jpg
2020-09-27T07:00:00.000000000Z	「素敵よ～っ」「最高」「カッコ可愛い」香取慎吾、ウクレレを持った陽気なショットにファン歓喜 【ABEMA TIMES】 | ABEMA TIMES - AbemaTIMES	「素敵よ～っ」「最高」「カッコ可愛い」香取慎吾、ウクレレを持った陽気なショットにファン歓喜。ABEMA TIMES[アベマタイムズ]は「見たい！」がみつかる情報ニュースサイトです。ABEMAの番組を中心に、ニュース映像や面白動画の紹介、著名人のインタビュー等選りすぐりの情報をお届けします。			https://times.abema.tv/news-article/8626076	https://times.abema.tv/files/topics/8626076_ext_col_40.jpg?v=1601172239
2020-09-27T07:00:00.000000000Z	音楽のチカラで暮らしを豊かに - 朝日新聞社	青春ポップスを歌う。音楽にあわせて軽い運動をする。エレクトーン、ウクレレを演奏する。こうした音楽レッスンに挑戦できる体験会が2月、ヤマハ音楽振興会の協賛で都内で開かれました。参加したのはReライフの読者会議メンバー計22人。盛り上がりを見せた当日の模様をご紹介します。			https://www.asahi.com/relife/article/13718483	https://p.potaufeu.asahi.com/4ce3-p/picture/21315299/ae566253288191ce5d879e51dae1d8c3.jpg
2020-09-27T07:00:00.000000000Z	「素敵よ~っ」「最高」「カッコ可愛い」香取慎吾、ウクレレを持った陽気なショットにファン歓喜（2020年9月27日）｜BIGLOBEニュース - BIGLOBEニュース	俳優の香取慎吾が9月26日に自身のInstagramを更新。ウクレレを弾く陽気なオフショットを公開し、話題となっている。ViewthispostonInstag…（2020年9月27日 11時3分0秒）			https://news.biglobe.ne.jp/entertainment/0927/abt_200927_9414052998.html	https://news.biglobe.ne.jp/entertainment/0927/9414052998/abt_8626076_ext_col_40_thum800.jpg
2020-09-26T07:00:00.000000000Z	２色ハイビスカス、熊本市で咲く 品種改良前に「先祖返り」 ｜ 熊本日日新聞 - kiji.is	熊本市南区のウクレレ講師直江裕美さん（４８）方の庭で、１輪だけ黄とピンクが半々のツートンカラーのハイ...			https://this.kiji.is/682397462319711329	https://nordot-res.cloudinary.com/c_fill,w_800,h_400,g_faces,f_auto,q_auto:eco/ch/images/682434177263469665/origin_1.jpg
2020-09-26T07:00:00.000000000Z	２色ハイビスカス、熊本市で咲く 品種改良前に「先祖返り」（熊本日日新聞） - Yahoo!ニュース	熊本市南区のウクレレ講師直江裕美さん（４８）方の庭で、１輪だけ黄とピンクが半々のツートンカラーのハイビスカスが咲いているのが見つかった。５枚の花びらのうち３枚が黄色、２枚がピンクになっている。			https://news.yahoo.co.jp/articles/98e774d87fb5ff7b91b3f143f615774253328055	https://amd.c.yimg.jp/amd/20200926-00000003-kumanichi-000-2-view.jpg
2020-09-23T09:03:41.000000000Z	平井 大、「THE FIRST TAKE」第二弾「僕が君に出来ること」をYouTubeプレミア公開（BARKS） - Yahoo!ニュース	平井 大が本日9月23日22時、一発撮りのパフォーマンスを鮮明に切り取る人気YouTubeチャンネル「THE FIRST TAKE」に再び登場することが発表された。			https://news.yahoo.co.jp/articles/8d0b23961ccb57cbc156d4673a3903171d705db9	https://amd.c.yimg.jp/amd/20200923-00189465-bark-000-1-view.jpg
2020-09-23T07:00:00.000000000Z	フェンダーからHERのソウルフルなサウンドとスタイリングを体現したシグネイチャーStratocasterが登場（BARKS） - Yahoo!ニュース	FENDER MUSICAL INSTRUMENTS CORPORATION（以下フェンダー）が、グラミー賞受賞R&amp;BシンガーソングライターH.E.R.とのコラボレーションによるシグネイチャーStr			https://news.yahoo.co.jp/articles/ba81e9a3fc266a26d1bc771b90e8b8225e5475b6	https://amd.c.yimg.jp/amd/20200923-00189452-bark-000-1-view.jpg
2020-09-23T07:00:00.000000000Z	平井 大、「THE FIRST TAKE」第二弾「僕が君に出来ること」をYouTubeプレミア公開 - BARKS	平井 大が本日9月23日22時、一発撮りのパフォーマンスを鮮明に切り取る人気YouTubeチャンネル「THE FIRST TAKE」に再び登場することが発表された。◆プレミア公開 動画先日、同YouTubeチャンネ...			https://www.barks.jp/news/?id=1000189465	https://img.barks.jp/img/article/1000189465/H/1200.jpg
2020-09-23T07:00:00.000000000Z	野楽器『おうち時間が増えて「売れた商品」ランキングTOP10』を公開：紀伊民報AGARA - 紀伊民報	おうち時間が増えた影響で楽器の需要が上がっています株式会社⼭野楽器（本社︓東京都中央区銀座、代表取締役社⻑ ⼭野政彦）より、新型コロナウイルスによる外出⾃粛やおうち時間増の影響で、売り上げを伸ばした楽...			https://www.agara.co.jp/article/82086	https://kyodonewsprwire.jp/prwfile/release/M103514/202009184567/_prw_PI5im_B3zO580t.jpg
2020-09-23T07:00:00.000000000Z	8月30日は「サンレレの日」 三線+ウクレレ「愛される音」記念動画に - 47NEWS	【読谷】三線とウクレレを融合した沖縄生まれの楽器「サンレレ」。その魅力を広く知ってもらおうと、楽器の提案者であるディアマンテスのアルベルト城間さんや開発者の三線工房マチダヤ（町田宗朝社長、読谷村高志 ...			https://www.47news.jp/5289548.html	https://img.cf.47news.jp/public/photo/a79a18916a023efc8199a60ee7895f51/photo.jpg
2020-09-23T07:00:00.000000000Z	マイ・ケミカル・ロマンスのジェラルド・ウェイ、ビリー・アイリッシュのウクレレを入手 - http://nme.com	マイ・ケミカル・ロマンスのジェラルド・ウェイは最近贈られたビリー・アイリッシュのフェンダー製シグネイチャー・ウクレレで新曲をレコーディングするかもしれないと述べている。...			https://nme-jp.com/news/93543/	https://nme-jp.com/nmesite/wp-content/uploads/2020/09/BillieGerard.jpg
2020-09-23T07:00:00.000000000Z	ウクレレの日の1週間後は「サンレレの日」 沖縄産の楽器アピール - 沖縄タイムス	【読谷】三線とウクレレを掛け合わせた沖縄県産楽器「サンレレ」を開発・販売しているＭＡＣＨＩＤＡＹＡ（読谷村、町田宗朝社長）はこのほど、サンレレのさらなる普及につなげようと、８月３０日を「サンレレの日」に制定すると宣言した。			https://www.okinawatimes.co.jp/articles/-/636315	https://oki.ismcdn.jp/mwimgs/e/c/-/img_ecae6c7abb395f17c1dccbed831cdf92770428.jpg
2020-09-22T07:00:00.000000000Z	ウクレレシンガー・KAIKI、2020年初のワンマンライブ開催決定 - E-TALENTBANK	国内外問わず幅広いシーンで活躍中のウクレレシンガーKAIKIが、10月3日に今年初のワンマンライブをブルースアレイジャパン(目黒)で開催する。			https://e-talentbank.co.jp/news/166079/	https://etb-media-photo.s3.ap-northeast-1.amazonaws.com/wp-content/uploads/2020/09/22102933/iOS-%E3%81%AE%E7%94%BB%E5%83%8F-788x630.jpg
2020-09-22T00:43:00.000000000Z	岩瀬牧場でハワイ気分 フラショーやウクレレ披露 鏡石 - 47NEWS	「岩瀬牧場にハワイがやってくる！」と銘打ったイベントは二十日、鏡石町の同牧場で開かれ、多くの来場者が常夏の雰囲気を味わった。 初めての企画で、フラショーやウクレレのレッスン、ワークショップを繰り広げ ...			https://www.47news.jp/localnews/5285710.html	https://img.cf.47news.jp/public/photo/38b4f8a3d6dbdf67d4e9b52d7f9e06ed/photo.jpg
2020-09-20T07:00:00.000000000Z	第15回マウイ ウクレレ フェステイバル - ニコニコニュース	世界で活躍するウクレレのアーテイストたちがマウイ島のMaui Arts &amp; Cultural Centerに集結して開催するマウイ島のビッグイベントの一つです。地元の子供たちやシニアの方々も参加する笑顔と愛が集まる希望の祭典になります。A…			https://news.nicovideo.jp/watch/nw8143569	https://news.cdn.nimg.jp/articles/images/8143569/2212aacd2b9d1bd3b9bc759068252be3334e028216f1b275d01aa7d2acb2f2970a43fed268f1f1c87e359b08dc1390b38085cd15fca6c2338c6c0cd54ef47919
2020-09-18T07:00:00.000000000Z	Vtuber・神楽すずを“ウクレレに”描いてみた！ 電熱ペンの焦がしの濃淡で表現された御姿に「なんて清楚なんだ」「これが痛レレか」の声 - ニコニコニュース	今回紹介したいのは、ぜろさんが投稿した『【ウクレレ】神楽すずを焦がしてみた【自作キット】』という動画です。投稿者メッセージ（動画説明文より）電熱ペンを利用した『ウッドバーニング』と呼ばれる作品です。 今回は、アイドル部のウキウキウクレレ…			https://news.nicovideo.jp/watch/nw8125904	https://news.cdn.nimg.jp/articles/images/8125904/da3d94ce7f6f0ec677153ca1ccc49fe10db3fde30dab659a8594471487cbf4a78e22ccf595aac00f5185353276262b6fb421f22c90629de89a3ef05ae34a4f51
2020-09-17T07:00:00.000000000Z	【ネット限定先行販売商品】『使うコードは最大5つ! 超初級のウクレレ弾き語り』9月28日発売！ (2020年9月17日) - エキサイトニュース	画像:https://newscast.jp/attachments/AlVOrchGkKN432tVqO6Z.jpg使うコードは最大5つ!超初級のウクレレ弾き語りウクレレ初心者でも気軽に楽しめる弾き...			https://www.excite.co.jp/news/article/Atpress_226877/	https://s.eximg.jp/exnews/feed/Atpress/Atpress_226877_1.jpg
2020-09-17T07:00:00.000000000Z	岩瀬牧場でハワイ体感を ２０日、ウクレレやフラダンス | 福島民報 - 福島民報	「岩瀬牧場にハワイがやってくる！」と題したイベントが二十日、鏡石町の同牧場で開かれる。初めての企画で、フラショーやスタンプワークショップ、ウクレレのレッスンを繰り広げる。 開催時間は午…			https://www.minpo.jp/news/detail/2020091779083	https://www.minpo.jp/common/img/news/2020091779083_0.jpg
2020-09-17T07:00:00.000000000Z	県産材ギター製作始動 ウクレレ試作 加工で課題も 五箇山・辻四郎工房 - 中日新聞	乱伐で調達が難しくなってきたギター用高級木材の代替材に、県産スギの間伐材を使うプロジェクトが南砺市・五箇山の「辻四郎ギター工房」で始ま...			https://www.chunichi.co.jp/article/122146	https://static.chunichi.co.jp/image/article/size1/8/8/7/3/887303a0a49af4f8ad66b14a78156b8c_1.jpg
2020-09-16T07:00:00.000000000Z	ビリー・アイリッシュ、待望の新曲＆MVを数週間後にリリースすると発表！ 超小声でこっそりファンに伝える[動画あり] - TVグルーヴ・ドット・コム	人気歌手のビリー・アイリッシュ（18）が、新曲とそのMVを数週間後にリリースすると発表した。 ビリー・アイリッシュは9月14日、インスタグラムの生配信を実施。そこで彼女は「最近2時間以上寝てない。新しいプロジェクトをスタ...			https://www.tvgroove.com/?p=49737	https://www.tvgroove.com/wp-content/uploads/2020/09/billie-1.jpg
2020-09-15T07:00:00.000000000Z	大ヒットラブコメ『50回目のファースト・キス』、リブートショートムービーを公開！2020年に目覚めたルーシーにヘンリーが説明したこととは？［動画あり］ - TVグルーヴ・ドット・コム	※本記事には『50回目のファースト・キス（原題：50 First Dates）』のネタバレが含まれます。 &nbsp; &nbsp; 2004年に米公開されたラブコメ映画『50回目のファースト・キス（原題：50 Firs...			https://www.tvgroove.com/?p=49574	https://www.tvgroove.com/wp-content/uploads/2020/09/DrewBarrymore.jpg
2020-09-15T07:00:00.000000000Z	多和田えみ、Tomoki Sato共作の甘く切ない新曲「SUMMER RAIN」配信（音楽ナタリー） - Yahoo!ニュース	多和田えみが明日9月16日にウクレレ奏者でシンガーソングライターのTomoki Satoをフィーチャーした新曲「SUMMER RAIN」を配信リリースする。			https://news.yahoo.co.jp/articles/8a0a0cc020ef2fc8d532736c4c1f9f9878f4881c	https://amd.c.yimg.jp/amd/20200915-00000059-natalien-000-1-view.jpg
2020-09-15T07:00:00.000000000Z	今月のマンスリースペシャルアーティストは、 ウクレレのスーパープレイヤー・ ジェイクシマブクロ！ - ニコニコニュース	今月のマンスリースペシャルアーティストは、ジェイクシマブクロ！ ウクレレを弾いたことがない人、余り興味がない人でも、名前だけは聞いたことがある方も多いのではないでしょうか?! 先月の特集アーティストCharや、LaniLaniミュージッ…			https://news.nicovideo.jp/watch/nw8106892	https://news.cdn.nimg.jp/articles/images/8106892/f25c3c75f94a39db93877b1583a57e26ac93a70310fd0d4eb5ff190028e7ff0fec11310840717fd091afda43972cd84a8079b34e78381c6721f2b17eab4ca321
2020-09-11T07:00:00.000000000Z	「竹内涼真の撮休」特報映像で寝起き姿を公開（MusicVoice） - Yahoo!ニュース	竹内涼真が本人役で主演を務めるドラマ『竹内涼真の撮休』（WOWOWプライム、11月6日スタート）の特報映像がこのほど公開された。特報映像は、撮休となった理由を明らかするオープニングの一幕で、寝起き			https://news.yahoo.co.jp/articles/a175a0f3636f3793c9ba514bf46797107bc6fff9	https://amd.c.yimg.jp/amd/20200911-00010001-musicv-000-1-view.jpg
2020-09-11T07:00:00.000000000Z	平井 大、「祈り花 2020」をウクレレの弾き語りで一発撮り披露 | BARKS - BARKS	YouTubeチャンネル「THE FIRST TAKE」の新コンテンツ「THE FIRST TAKE」第53回の詳細が発表された。「THE FIRST TAKE」は、一発撮りのパフォーマンスを鮮明に切り取るYouT...			https://www.barks.jp/news/?id=1000188856	https://img.barks.jp/img/article/1000188856/H/1200.jpg
