updated	title	description	tags	除外	link	image
2020-04-27T07:00:00.000000000Z	ＮＨＫ近江アナ、進行ミスはウクレレのせい？「気が散りました、ごめんなさい」 - サンケイスポーツ	ＮＨＫの近江友里恵アナウンサー（３１）が２７日放送の同局「あさイチ」（月～金曜前８・１５）に出演。再度ウクレレで「ハッピーバースデートゥーユー」を披露した。 …			https://www.sanspo.com/geino/news/20200427/geo20042722060025-n1.html	https://www.sanspo.com/geino/images/20200427/geo20042722060025-p1.jpg
2020-04-27T07:00:00.000000000Z	高木ブー、サザン関口、荻野目洋子、ジェイクら「ウクレレでリレー音楽会」 - ナタリー	5月2日（土）21:00よりNHK BS1で「外出自粛の夜に～ウクレレでリレー音楽会～」が放送される。			https://natalie.mu/music/news/377038	https://ogre.natalie.mu/media/news/music/2020/0427/takagiboo_photo.jpg?imwidth=750
2020-04-11T07:00:00.000000000Z	スマホ連動キューブパズル、スマートウクレレ、コンパクトミラー型バッテリー、MoMA Design Storeで見つけた近未来的ガジェット9選 - @DIME	え、家から出れなくて退屈？それなら近未来的なアイテムを見てワクワクしようよ。スマートフォンと連携するキューブパズル「Giiker スマート スーパーキューブ」をはじめ、モバイルバッテリー機能を搭載したコ...			https://dime.jp/genre/890819/	https://dime.jp/genre/files/2020/04/97cda31fca12f1b631b5db521ac9a2a7-770x479.png
2020-04-06T07:00:00.000000000Z	KoAloha Ukuleleから初心者でも扱いやすい低価格なKoAlanaシリーズ3モデル - BARKS	ハワイを代表するウクレレ・ブランドKoAloha（コアロハ）から、コストパフォーマンスに優れたKoAlana（コアラナ）シリーズが登場。ソプラノ、コンサート、テナーの3サイズのラインナップで発売される。KoAlan...			https://www.barks.jp/news/?id=1000180883	https://img.barks.jp/img/article/1000180883/H/1200.jpg
2020-03-24T07:00:00.000000000Z	中学生ウクレレプレイヤー近藤利樹、『ねこねこ日本史』ED曲でラッパーASOBOiSMとコラボ - BARKS	現役中学生ウクレレプレイヤー近藤利樹が、テレビアニメ『ねこねこ日本史』の第5期エンディング主題歌「ねこじゃらそーかけるまほうひみこ」を担当することが発表された。◆関連画像『ねこねこ日本史』は、「卑弥呼」や「坂本龍馬...			https://www.barks.jp/news/?id=1000180334	https://img.barks.jp/img/article/1000180334/H/1200.jpg
2020-03-11T07:00:00.000000000Z	小・中学生の子供を持つ親100名に、ウクレレをプレゼント！フェンダーが「楽器をはじめよう! キャンペーン」を開始。 - 朝日新聞社	フェンダーミュージックが、これからの春夏シーズンに向けて、楽器を始めてみたいと考えている小・中学生と、その親を応援する「楽器をはじめよう! キャンペーン」を3月4日よりスタートし…			https://asm.asahi.com/article/13202539	https://p.potaufeu.asahi.com/5014-p/picture/20438000/7d19ef7f6cb5cb0b71f4696b10f61d82.jpg
2020-03-07T08:00:00.000000000Z	津田駅ちかくに「といろcafe」ってウクレレとギターを教える喫茶店ができてる。スーパービッグサンのなか - 枚方つーしん	津田駅近くに「といろcafe」というウクレレとギターを教える喫茶店ができています。↓こちら以前、この場所には「CAFE Amber」がありました↓地図ではここ↓住所は大阪府交野市倉治8-11-7です。スーパービッグサンの中にあります。お店のメニュー↓コーヒー350円。スイーツ			http://www.hira2.jp/open/toiro-20200306.html	https://livedoor.blogimg.jp/hiratsu/imgs/4/5/45d0345e-s.jpg
2020-03-05T08:00:00.000000000Z	フェンダー、小中学生向けにウクレレがもらえる「楽器をはじめよう!キャンペーン」を開始 - ASCII.jp	フェンダーミュージックは3月4日、小中学生およびその保護者を応援する「楽器をはじめよう！キャンペーン」を開始した。			https://ascii.jp/elem/000/004/005/4005088/	https://ascii.jp/img/2020/03/05/3018576/l/d12d8e2f417f7eff.jpg?20200122
2020-03-04T08:00:00.000000000Z	ウクレレがもらえる「楽器をはじめよう！キャンペーン」が開始 - PR TIMES	フェンダーミュージックのプレスリリース（2020年3月4日 09時00分）ウクレレがもらえる[楽器をはじめよう！キャンペーン]が開始			https://prtimes.jp/main/html/rd/p/000000127.000021878.html	https://prtimes.jp/i/21878/127/ogp/d21878-127-916935-0.jpg
2020-02-18T08:00:00.000000000Z	ハワイの空に響いた「いい湯だな」…高木ブーが87歳を前に現地ライブ、長女が明かす父の思い｜まいどなニュース - 神戸新聞社	音楽イベント「ウクレレ・ピクニック・イン・ハワイ」に４年連続出演し、ウクレレで弾き語りする高木ブー 今年３月８日に８７歳の誕生日を迎える高木ブー。米ハワイで現地16日に開催された音楽イベント「ウクレレ・ピクニック・イン・ハワイ」で現...			https://maidonanews.jp/article/13138806	https://public.potaufeu.asahi.com/d6f4-p/picture/20152392/3947b6818d7494952bed3ef3090f4169.jpg
2020-01-30T08:00:00.000000000Z	人気音楽教室トップは「ウクレレ」 山野楽器、2019年下期ランキング - オーヴォ	山野楽器 「2019年下期人気レッスンランキング TOP10」 &nbsp; 山野楽器（東京都中央区）は、同社の音楽教室「ヤマノミュージックサロン」などで体験レッスンを受けた生徒数の多さで決める2019年下期（7月から12月）人気レッスン			https://ovo.kyodo.co.jp/ch/mame/a-1403735	https://d10tw3woq6mt3i.cloudfront.net/wp-content/uploads/2020/01/kyd_1403735_prw_PI1fl_hKep5JSt.jpg
2020-01-30T08:00:00.000000000Z	近藤利樹、Billboard cafe & dining単独ライブ最年少出演 - BARKS	ウクレレプレイヤー近藤利樹が4月26日（日）に、日比谷Billboard cafe & diningで単独ライブ＜UKULELE LIVE！【SPRING WITH ‟U”】＞を開催することが決定した。近藤利樹は同...			https://www.barks.jp/news/?id=1000178059	https://img.barks.jp/img/article/1000178059/H/1200.jpg
2020-01-27T08:00:00.000000000Z	ウクレレは僕の心臓 ナニワの中1、フジロックで速弾き - 朝日新聞デジタル版	■ひと フジロックに出演した「ナニワの光速ウクレレ少年」 近藤利樹さん（12） 速弾きが得意で「ナニワの光速ウクレレ少年」と呼ばれる近藤利樹さん（12）は大阪の中学1年生。昨年は、国内最大級の野外音楽…			https://www.asahi.com/articles/ASN1W40W5N1PPTIL017.html	https://www.asahicom.jp/articles/images/c_AS20200127001459_comm.jpg
2020-01-20T08:00:00.000000000Z	【八尾市】今年は新たに楽器を始めてみませんか？本町にある光専寺で無料ウクレレ教室が開かれていますよ～ - 号外NET 八尾	八尾市本町にある光専寺。 現在居場所カフェ『えんがわホーホケキョ』を開かれているのでも知られていますね。 その&hellip;			https://yao.goguynet.jp/2020/01/20/ukurere-kosenji/	https://yao.goguynet.jp/wp-content/uploads/sites/17/2020/01/2e6245bef86d3956b63536597dfc33e9_s.jpg
2020-01-17T08:00:00.000000000Z	ストラトやジャズマスターのシェイプのウクレレが登場、フェンダーFullertonシリーズがNAMMで発表 - BARKS	フェンダーのアイコニックなギターシェイプやカラーをフィーチャーしたウクレレが登場。米カリフォルニア州アナハイムで開催中のNAMM 2020で、Fender Musical Instruments Corporati...			https://www.barks.jp/news/?id=1000177482	https://img.barks.jp/img/article/1000177482/H/1200.jpg
2020-01-15T08:00:00.000000000Z	高木ブーをハワイアン、ザ・ドリフターズ、雷様に導いたウクレレ | 愛する楽器 第19回 - ナタリー	「生意気だけどウクレレと僕の人生は縁があったんじゃないかな」 - アーティストがお気に入りの楽器を紹介するこの連載。第19回では高木ブーを迎え、彼が歩んできた人生を振り返ると共に、ハワイアンミュージックやウクレレとの出会い...			https://natalie.mu/music/column/362704	https://ogre.natalie.mu/media/news/music/2020/0110/191126_126.jpg?imwidth=750
2019-12-24T08:00:00.000000000Z	MoMa、スマホアプリでスピード上達できるウクレレとスマートキューブパズル - 家電 Watch	ニューヨーク近代美術館「MoMA」のミュージアムショップ、 MoMA Design Storeは、スマートフォン専用アプリに接続して楽しく練習できる「スマートウクレレPOPULELE」と、モーションセンサーを内蔵したスマートコネクトスキューブパズル「Giiker スマートキューブ」を発売した。価格は順に18,480円、5,940円(どちらも税込)。			https://kaden.watch.impress.co.jp/docs/news/1225482.html	https://kaden.watch.impress.co.jp/img/kdw/list/1225/482/001.jpg
2019-12-23T08:00:00.000000000Z	ビリー・アイリッシュ、“Carpool Karaoke”でウクレレの腕前を披露＆憧れのJ・ビーバーとの初対面を振り返る | Daily News - billboard-japan.com	ビリー・アイリッシュが、2019年12月19日に米深夜番組『レイトx2ショーwithジェームズ・コ			http://www.billboard-japan.com/d_news/detail/83346	http://www.billboard-japan.com/scale/news/00000083/83346/x200_image.jpg
2019-12-13T08:00:00.000000000Z	ハワイ ホノルル、2月16日「第12回 ウクレレピクニック・イン・ハワイ 2020」開催 - トラベルビジョン	トラベルビジョンでは旅行業界、またはその関連作業で従事する方々のための有益な情報を日刊トラベルビジョンで毎日お届けしています。			http://www.travelvision.jp/news/detail.php?id=87444	http://www.travelvision.jp/common/img/header/logo.jpg
2019-11-26T08:00:00.000000000Z	枚方T-SITEでウクレレ少年の近藤利樹がライブをするみたい。11月30日 - 枚方つーしん	枚方T-SITEでウクレレ少年の近藤利樹くんがミニライブをするようです。T-SITEイベント｜T-SITE公式サイト枚方出身のウクレレ少年 近藤利樹くんが1stフルアルバム「WITH ‟U”」のリリースを記念して、枚方T-SITEにてミニライブ＆特典会を開催するそうです。近藤利樹くんとい			http://www.hira2.jp/topic/kondotoshiki-20191126.html	https://livedoor.blogimg.jp/hiratsu/imgs/5/d/5d0f1c41.jpg
2019-11-12T08:00:00.000000000Z	初心者でもすぐに弾ける！ スマホと連動するスマートウクレレ「Populele S1」 - Techable	何か楽器が弾けたら、と憧れを持っている人は少なくないのではないだろうか。しかし音楽教室に通うというのは、時間のやりくりや気持ちの上でなかなかハードルが高いものだ。 そんな人にうってつけの楽器が、クラウドファンディングサイ...			https://techable.jp/archives/111768	https://techable.jp/wp-content/uploads/2019/11/fullsizeoutput_754e-e1573490237858.jpeg
2019-11-05T08:00:00.000000000Z	【100万円突破！】スマホと連動で簡単に曲を演奏できる♪スマートウクレレPopulele S1 - PR TIMES	阿芙株式会社のプレスリリース（2019年11月5日 10時56分） 100万円突破！ スマホと連動で簡単に曲を演奏できる♪スマートウクレレPopulele S1			https://prtimes.jp/main/html/rd/p/000000183.000030574.html	https://prtimes.jp/i/30574/183/ogp/d30574-183-541228-0.jpg
2019-11-01T07:00:00.000000000Z	近藤利樹、初のオフィシャル・ウクレレ教則本発売 | BARKS - BARKS	大人顔負けの光速弾きで注目を集め、＜FUJI ROCK FESTIVAL			https://www.barks.jp/news/?id=1000173945	https://img.barks.jp/img/article/1000173945/H/1200.jpg
2019-06-22T07:00:00.000000000Z	近藤利樹 現役中学生・12才のウクレレ奏者。今年のFUJI ROCKに史上最年少で出演 - エンタメステーション	“世界に響く日本のポップカルチャー”を伝えるWebメディア			https://tokyo.whatsin.jp/463228	https://d2wi3xvhr3qrd7.cloudfront.net/wp/wp-content/uploads/2019/06/17194123/f747de25f098011e2f121f7bbea9febd-1128x846.jpg